id,artist,song_title,decade,lyrics,alt_lyrics
17302002,DJ Jazzy Jeff & The Fresh Prince,Just One of Those Days,1980s,have you ever in your life experienced a day where nothing at all seems to go your way no matter how hard you try to get out of the rut you just could not break the string of bad luck a day where murphys law takes over your life and you just cant seem to do a darn thing right and when the day was over you just had to say you said man its just one of those days my day started off kind of cool i brushed my teeth i comed my hair and i got dressed and went to school i stopped at the store for a breakfast snack a tasty cake and orange juice and a bubble yum pack about that point i proceeded to class i spoke to all the pretty girls that i passed i went to my room which was on the first floor i had no idea what i was in for i sat in my desk and minded my own business someone knocked on the door the teacher said who is it this girl walked in my imigination ran wild she stole my heart just by the way that she smiled i couldnt resist so i grabbed her butt she said whats wrong with you fool are you some kind of nut the teacher turned around while my arm was extended she looked me in the face and said prince youre suspended i said your tripping its just a bad habit she put it in my face she mustve wanted me to grab it i pleaded my case but she wrote the pink slip then i just shoke my head i said i dont beleive this she sent me to the head of the discipline staff i tried to play it off so i started to laugh i said ha ha this story is great its a big misunderstanding one big mistake,have ever life experienced day where nothing seems matter hard try rut break string bad luck day where murphys law takes life cant seem darn thing right day was had said man those days day started off kind cool brushed teeth comed hair got dressed went school stopped store breakfast snack tasty cake orange juice bubble yum pack point proceeded class spoke pretty girls passed went room was floor had idea was sat desk minded own business someone knocked door teacher said girl walked imigination ran wild she stole heart she smiled couldnt resist grabbed her butt she said whats wrong fool are kind nut teacher turned around while arm was extended she looked me face said prince youre suspended said tripping bad habit she face she mustve wanted me grab pleaded case she wrote pink slip shoke head said beleive she sent me head discipline staff tried play off started laugh said ha ha story great big misunderstanding big mistake
90334386,DJ Jazzy Jeff & The Fresh Prince,He's The D.J. I'm The Rapper,1980s,uh uh ah uh yo jeffrey buss it what are ya doin in there word em up word em up word em up in the place at about this time dj jazzy jeff and the fresh prince just bu bu buggin out losing it all no sense ay jeff scratch it scratch it man scratch it uh aw that was decent now scratch it a quick joint a quick one jeff oh yeah yeah we just bugging we just having some fun me and jeffrey hes the dj im the rapper hello can anybody hear me you can aight thats good you can hear me okay its clear its good okay everybodys got it one two one two and my rhymes have been written not to be bitten but as it seems some suckers keep forgetting the rules about rappin but thats alright cause in the next five minutes im a have them all uptight stronger than a dinosaur better known than santa man the battles i battle i usually win em in less than a minute but it all depends on how long it takes you rappers to realise that trying to defend yourself is ridiculous didnt you get my message its out of the question cause youre toys boys im the real mccoy im really gonna enjoy seeing you destroyed if i was fred flintstone id probably own all of bedrock if i was a criminal id probably own a cellblock if i was in the navy i would own the sea but im a poet so i own the whole rap industry,uh uh ah uh yo jeffrey buss are ya doin word em word em word em place dj jazzy jeff fresh prince bu bu buggin losing sense ay jeff scratch scratch man scratch uh aw was decent scratch quick joint quick jeff yeah bugging having fun me jeffrey hes dj rapper hello anybody hear me aight hear me okay clear okay everybodys got two rhymes been written bitten seems suckers keep forgetting rules rappin alright cause next five minutes uptight stronger dinosaur better known santa man battles battle usually win em less minute depends long takes rappers realise trying defend yourself ridiculous didnt message question cause youre toys boys real mccoy really gonna enjoy seeing destroyed was fred flintstone id probably own bedrock was criminal id probably own cellblock was navy own sea poet own whole rap industry
100063258,Ashford feat. Simpson,Babies,1980s,it happened innocently you gave your love to me who could blame us that night i was so late coming in who could blame us i couldnt explain exactly where id been but your mama shouldnt have told you your mama shouldnt have told you babies were made in heaven it was splendor in the grass it happened so fast who could blame us we were so close i could hardly catch my breath,it happened innocently gave love me blame night was late coming blame couldnt explain exactly where id been mama shouldnt told mama shouldnt told babies were made heaven was splendor grass happened fast blame were close hardly catch breath
1558791,The 2 Live Crew,C'mon Babe (Doo Doo Brown mix),1980s,bm brother marquis fki fresh kid ice intro sound of woman being fucked verse 1 bm when the partys over we can get together go to my house and fuck forever and do whatever comes to mind let me stick my dick in your behind you can pour me a glass of dom perignon then suck my dick until i cum soft is your body tender is your kiss cmon baby we can do this fki no need to act stuck up pretty and seditty got a funky disposition and you think youre witty youre not used to people saying things like this its called criticism and not a diss i only give compliments when they are due now im gonna tell you all the truth you claim to be a virgin i mean the purest ill be gentle baby cause we can do this verse 2 bm love is the key to end all your woes youll be my bitch not a dirty hoe together as one we will be,bm brother marquis fki fresh kid ice intro sound woman being fucked verse 1 bm partys together house fuck forever whatever comes mind me stick dick behind pour me glass dom perignon suck dick cum soft body tender kiss cmon baby fki need act stuck pretty seditty got funky disposition youre witty youre used people saying things called criticism diss compliments are due gonna tell truth claim virgin mean purest ill gentle baby cause verse 2 bm love key end woes bitch dirty hoe together be
33964885,Newcleus,No More Runnin' (Original Arrangement),1980s,ooo ooo ooo oooh no more runnin ooo ooo ooo oooh no more runnin used to be once upon a time that i never would fight / for somethin id back down turn around and run and it would always come / to nothin but now ive found a better way i turned my eyes and my heart up skyward now its a brand new day and its gonna be my finest hour ive got the power ooo ooo ooo oooh no more runnin ooo ooo ooo oooh no more runnin now nothin keeps me down i stand my ground when i have to,ooo ooo ooo oooh more runnin ooo ooo ooo oooh more runnin used once upon never fight / somethin id down turn around run always / nothin ive found better turned eyes heart skyward brand day gonna finest hour ive got power ooo ooo ooo oooh more runnin ooo ooo ooo oooh more runnin nothin keeps me down stand ground to
38038451,Run-DMC,How'd Ya Do It Dee,1980s,yeah one two one two and i say as we let the music play this is dedicated to ruddy ray from all the homeboys around the way so def it wont get an f jay receives an a for his essay spins til youre dizzy born to get busy is he the jam master isnt he or is he and my name is dmc the k i n g the car that i drive is called a caddy the drink that i drink is called oe and i wear my glasses so i can see my homeboy right next to me his name is dj run shoots a gift like a gun slays suckers one by one rather chill than kill cause the killings no fun so together forever crew be tougher than leather we gonna slay the bad ones until there are none run dmcs award nominee the k i n gs of all m i cs like hercules with rhymes like these never crackin not lackin and i still pull gs,yeah two music play dedicated ruddy ray homeboys around def wont f jay receives his essay spins til youre dizzy born busy he jam master isnt he he name dmc k n g car drive called caddy drink drink called oe wear glasses homeboy right next me his name dj run shoots gift gun slays suckers one rather chill kill cause killings fun together forever crew tougher leather gonna slay bad ones are none run dmcs award nominee k n gs m cs hercules rhymes never crackin lackin pull gs
17392123,DJ Jazzy Jeff & The Fresh Prince,Rock The House,1980s,when we rock the house there is no doubt is no doubt that me and ready c will turn it out turn it out were down with the dj jazzy jeff jazzy jeff and you know that we are def that were def and you should not settle for less than the undisputed best thats right we are the best everywhere we go every time we do a show everybody wants to know how we make em say ho the way we do is not a magical trick its just a lotta def rhymes just like this somebody yell hooohooo ho say ho ho ho ho now im the fresh prince hello how do you do i just have a little fun with the rest of my crew so take a chill and just relax yo ready c pretend that youre a dj and scratch go ready rock go ready rock all right now bust a move and get the hell out if youre tryin to bust the groove,when rock house doubt doubt me ready c turn turn were down dj jazzy jeff jazzy jeff are def were def should settle less undisputed best right are best everywhere every show everybody wants em ho magical trick lotta def rhymes somebody yell hooohooo ho ho ho ho ho fresh prince hello do little fun rest crew chill relax yo ready c pretend youre dj scratch ready rock ready rock right bust move hell youre tryin bust groove
49643803,Ice-T,Power,1980s,im livin large as possible posse unstoppable style topical vividly optical listen youll seeem sometimes ill beem cops critics and punks necer ever wanta see me in power well thats too bad apocalypse now im back and im mad were comin youre runnin cold and cunning ice t on the mic topgunning after your neck checkin respect makin you sweat rhyme syndicate boy in effect the rap motivator teacher talker night rhyme stalker words thrillin so real theyre chillin the hit author gettin louder than a shot gun you dont want none rhyme pays was the name of the album but that was number one this is the number two the posse grew were gonna break through power somebody line up the suckers who refuse to recognize the truth tie up the punks who refuse to understand the youth my posses growin and its gettin larger every day detroit chi town pittsburgh houston la come on come on come on toys lets play circle the calendar perpetrator doomsday ice t fool man of my own full grown i cause havoc when i speak upon the microphone im outspoken no jokin get in my face your jaw will get broken layin it sayin it then youre playing it lyrics so heavy that you might try weighin it hated by many but i hateem back loved by troopers who know where its at you might like me might think im wack but dont step to me cause the boy stays strapped im taking no shorts hatin the courts hatin the judges,im livin large possible posse unstoppable style topical vividly optical listen seeem sometimes ill beem cops critics punks necer ever wanta me power too bad apocalypse im mad were comin youre runnin cold cunning ice t mic topgunning neck checkin respect makin sweat rhyme syndicate boy effect rap motivator teacher talker night rhyme stalker words thrillin real chillin hit author gettin louder shot gun none rhyme pays was name album was number number posse grew were gonna break through power somebody line suckers refuse recognize truth tie punks refuse understand youth posses growin gettin larger every day detroit chi town pittsburgh houston la come toys lets play circle calendar perpetrator doomsday ice t fool man own full grown cause havoc speak upon microphone outspoken jokin face jaw broken layin sayin youre playing lyrics heavy might try weighin hated many hateem loved troopers where might me might wack step me cause boy stays strapped taking shorts hatin courts hatin judges
69078889,Mantronix,Simple Simon (You Gotta Regard),1980s,before i can pour what im sure youll adore take a seat in the heat and repeat what is sweet cause understanding all languages is not really hard you got to listen yes you gotta regard yeah before i can pour what im sure youll adore take a seat in the heat and repeat what is sweet cause understanding all languages is not really hard you got to listen yes you gotta regard this crew we hold the reel and the rod the duo of the eighties and mantronixs the squad so live the entertainment your smile will be our payment televised for all you eyes the tantalizing statements though beaurocratic our motto is love from above its not required you can take it or shove it like a glove it only fits if the feeling is right so if the feeling fits your taste then take a bite with delight its only fair the music is clear suffice a second slice of whats so rare dont redeem what is seen use your judgment of mind because a handicap is given to those who cant find,before pour sure adore seat heat repeat sweet cause understanding languages really hard got listen yes gotta regard pour sure adore seat heat repeat sweet cause understanding languages really hard got listen yes gotta regard crew hold reel rod duo eighties mantronixs squad live entertainment smile payment televised eyes tantalizing statements though beaurocratic motto love above required shove glove fits feeling right feeling fits taste bite delight fair music clear suffice second slice whats rare redeem seen judgment mind handicap given those cant find
90061350,Rodney O & Joe Cooley,Everlasting Bass,1980s,[rodney o] the bass thats in your face sho nuff shrugs your face just like you got sprayed by a can of mace you see your speaker is movin everybody is groovin my song moves along as it starts improvin the highs will get no higher the bass will go no lower cuz everlasting bass sho nuff moves a flower some people cant take it they try to plead the case but you cant get enough of everlasting bass,[rodney o] bass face sho nuff shrugs face got sprayed mace speaker movin everybody groovin song moves along starts improvin highs higher bass lower cuz everlasting bass sho nuff moves flower people cant try plead case cant enough everlasting bass
45633417,Sir Mix-A-Lot,Beepers,1980s,operators voice welcome to sky pager sound of beeper going off appears throughout song operators voice beepers beepers beepers beepers welcome to sky pager beepers press the pound key after each entry im rollin like a playboy beep beep beep just another page just another freak cops say im bangin girls say im slangin just cause my black cross courts be hangin ah huh thats it baby beep diddy beep will i call you maybe sky pager looks like a phaser thats the attire of a northwest player san jose i got a show chillin like a champ with a girl in a limo there we go again i got a beep the girl got nosy beggin for a peep get off me girl this is business im workin it and you cant witness a oakland skeeso how do i know cause 415 was the area code turn it off turn it on so i wont get busted you know rap stars never get trusted baby wanna get so i put it on vibrate how does mix a lot communicate operators voice with beepers baby haha beepers welcome to sky pager beepers to use sky pager beepers press the pound key after each entry beepers please enter the pin number you wish sky pager 3x,operators voice welcome sky pager sound beeper going off appears throughout song operators voice beepers beepers beepers beepers welcome sky pager beepers press pound key each entry rollin playboy beep beep beep another page another freak cops bangin girls slangin cause black cross courts hangin ah huh baby beep diddy beep call maybe sky pager looks phaser attire northwest player san jose got show chillin champ girl limo again got beep girl got nosy beggin peep off me girl business workin cant witness oakland skeeso cause 415 was area code turn off turn wont busted rap stars never trusted baby wanna vibrate does mix lot communicate operators voice beepers baby haha beepers welcome sky pager beepers sky pager beepers press pound key each entry beepers please enter pin number wish sky pager 3x
105216572,Kon Kan,Bite The Bullet,1980s,3 2 1 go every time i see your face every night i live my place in this dream you keep me comin back you keep me comin comin just cant seem to get you off my mind every time i feel this heat every night i want you next to me you keep me comin back you keep me comin comin just cant seem to get you off my mind in my flesh i wait stripped of my pride if you could only read my mind want to come indside,3 2 1 every face every night live place dream keep me comin keep me comin comin cant seem off mind every feel heat every night next me keep me comin keep me comin comin cant seem off mind flesh wait stripped pride read mind indside
93796193,Jungle Brothers,Beeds On A String,1980s,backed by the baby bam beat the rare groove jungle bros no competition and nothin to prove want me to be on your family tree but youre all about yourself which wont allow me to be you see im the kind of brother that gets up on the stage to get down for the people that came and paid i throw on my uniform but not to get pretty show no shame feel no pity you all showed up and im glad you came still the same person everythings the same once again i show towards you all due respect but my main concern for now is keepin things in check hands in the air and everybody will sing as they hang on the my rhythm like the beeds on my string recess my soul sings a funk e song as the beat goes on and on another day gone and still learnin my right from wrong the partys gettin packed as i turn up the bass more,backed baby bam beat rare groove jungle bros competition nothin prove me family tree youre yourself wont allow me kind brother gets stage down people came paid throw uniform pretty show shame feel pity showed glad came same person everythings same once again show towards due respect main concern keepin things check hands air everybody sing hang rhythm beeds string recess soul sings funk e song beat goes on another day gone learnin right wrong partys gettin packed turn bass more
45811795,Hieroglyphics,All Things,1980s,[chorus x2] all things aint what they seem youll get washed; even if youre way too clean [opio] i was ridin around the lake gettin smoked last night seen a gang of businessmen pilin out the scottish rite it was just lascivious cuz ducked in the three way givin those ridiculous handshakes to the pd and the da but im hip to the sign language its just an exchange of the blood brotherhood who remains nameless but to me yall famous and i got game just the same man it floods my brain ya cant frame us [pep love] they got plans plots and schemes like a dope fiend tryin to get that ice cream cola [opio] my nigga hold up things is not as they seem you get washed; even if youre way too clean [pep love] deceptions inception and interception of our direction is intertwined with what goes on in our minds take a look at your reflection what you perceive is based on what you believe is true,[chorus x2] things aint seem washed; youre too clean [opio] was ridin around lake gettin smoked last night seen gang businessmen pilin scottish rite was lascivious cuz ducked three givin those ridiculous handshakes pd da hip sign language exchange blood brotherhood remains nameless me yall famous got game same man floods brain ya cant frame [pep love] got plans plots schemes dope fiend tryin ice cream cola [opio] nigga hold things seem washed; youre too clean [pep love] deceptions inception interception direction intertwined goes minds reflection perceive based believe true
74640049,Tone-Loc,Cheeba Cheeba (Vocal),1980s,when i get to a party to get it started i grab tha microphone and rock it cold hearted go behind tha curtains while my fanz they point you know what locs doin im blazin a joint cause it seems a lot of times im at my best after some methical or a bowl of sense im creatin multiplyin big time supplyin enuff bud to keep tha whole party high on i might get ill and roll an 8th in one hooter park my benz or cold jet it on my scooter bail to tha coast take a head of this skunk twist up a big bomb of this serious dope smoke it down to tha dub or roach tip so much damn resin its startin to drip it aint harmful like heroin this stuffs cheap thats why im glad that i got this man dont cha hate it when you aint go no weed it seems about tha time you really feel tha need to get high get full you know get blasted keep ya singin tha high it really lasted rollin around tryin not to get stopped by tha boyz tha pigs you know tha cops pull into one spot to see what theyre all about suckers noddin their head tellin you theyre all out you go back to tha crib pick up tha telephone you try it so i guess they saw you got home cause i can buy it oz or go buy dime i get cash for her i can get it on time it really makes no difference long as i get lit,when party started grab tha microphone rock cold hearted behind tha curtains while fanz point locs doin blazin joint cause seems lot times best methical bowl sense creatin multiplyin big supplyin enuff bud keep tha whole party high might ill roll 8th hooter park benz cold jet scooter bail tha coast head skunk twist big bomb serious dope smoke down tha dub roach tip much damn resin startin drip aint harmful heroin stuffs cheap glad got man cha hate aint weed seems tha really feel tha need high full blasted keep ya singin tha high really lasted rollin around tryin stopped tha boyz tha pigs tha cops pull spot suckers noddin head tellin tha crib pick tha telephone try guess saw got home cause buy oz buy dime cash her really makes difference long lit
2000203,Jungle Brothers,“U” Make Me Sweat,1980s,[afrika] everybody gettin on my back some say ya just dont know how to act afrika you act too wild get away from me you cramp my style but lovely lady cant you see this is what you do to me got me workin to the bone then you ask whyyyyyy i aint home work all day and then at night i come runnin home to treat you right try to spend time with my two children but this world has got me goin round and round i just cant stop on and on i might just drop slippin and fallin but thats okay i do it all for you anyway do my best just to please you and in return this is what you do [chorus x2],[afrika] everybody gettin ya act afrika act too wild away me cramp style lovely lady cant me got me workin bone ask whyyyyyy aint home work day night runnin home treat right try spend children world has got me goin round round cant stop on might drop slippin fallin okay anyway best please return [chorus x2]
97482183,Neneh Cherry,Buffalo Stance (12'' Version),1980s,will you stop the scratching and give me a beat ladies and gentlemen id like to introduce the high hat go on thats good now the tambourine right now dj whos that gigolo on the street with his hands in his pockets and his crocodile feet hanging off the curb looking all disturbed at the boys from home they all came running they were making noise manhandling toys thats the girls on the block with the nasty curls wearing padded bras sucking beers through straws dropping down their drawers where did you get yours gigolo huh sukka gigolo gigolo huh sukka whos looking good today whos looking good in every way no style rookie you better watch dont mess with me no money man could win my love its sweetness that im thinking of we always hang in a buffalo stance we do the dive every time we dance ill give you love baby not romance ill make a move nothing left to chance so dont you get fresh with me get funky yeah timmy tell it like it is baby,will stop scratching me beat ladies gentlemen id introduce high hat tambourine right dj whos gigolo street his hands his pockets his crocodile feet hanging off curb looking disturbed boys home came running were making noise manhandling toys girls block nasty curls wearing padded bras sucking beers through straws dropping down drawers where did yours gigolo huh sukka gigolo gigolo huh sukka whos looking today whos looking every style rookie better watch mess me money man win love sweetness thinking always hang buffalo stance dive every dance ill love baby romance ill move nothing left chance fresh me funky timmy tell baby
100239495,Kurtis Blow,Daydreamin',1980s,looking back through time in the corners of my mind i see you standing here oh baby how i miss you and how much i need to kiss you run my fingers through your hair but then again its just my imagination being close to you was such a sweet sensation but then we had to have that terrible confrontation daydreamin takes me where i want to be daydreamin lets me have you here with me oh girl if you knew all that ive been going through,looking through corners mind standing baby miss much need kiss run fingers through hair again imagination being close was such sweet sensation had terrible confrontation daydreamin takes me where daydreamin lets me me girl knew ive been going through
