id,artist,song_title,decade,lyrics,alt_lyrics
33161202,Boogie Down Productions,Breath Control,1980s,krs one somebody beatboxing let me tell you bout a crew i know ba bum bum called boogie down productions and they steal the show ba bum bum with dj scott larock and krs one ba bum ba ba bum ba bum ba bum bababababababababa with d nice you know the job is done and i know boom ba bum oh yes i know ba boom ba bum i know because im krs one yo check this out beatbox continues in the background krs one breath control heres an example i appeal to the criminal minded you cant find it boy youre still blinded why dont you open your eyes and stop dissin get a prescription to listen sit in the class and ask real fast about a fresh rap youre gettin left back set back kept back get back i dont accept that material your rhymes are artificially flavored like cereal i like clarity so when you come here speak clear and concise and then i might give a little slack to nah wait i take that back if youre wack ill slap fuck that boogie down productions back simply cause we never left,krs somebody beatboxing me tell bout crew ba bum bum called boogie down productions steal show ba bum bum dj scott larock krs ba bum ba ba bum ba bum ba bum bababababababababa d nice job done boom ba bum yes ba boom ba bum krs yo check beatbox continues background krs breath control heres example appeal criminal minded cant find boy youre blinded open eyes stop dissin prescription listen sit class ask real fast fresh rap youre gettin left set kept back accept material rhymes are artificially flavored cereal clarity speak clear concise might little slack nah wait youre wack ill slap fuck boogie down productions simply cause never left
45633430,Sir Mix-A-Lot,The (Peek-A-Boo) Game,1980s,peek a boo this is the true story about a young lady i know peek a boo a walkin zombie product of the system peek a boo now shes play a game by her own rules peek a boo the peak a boo game deceptive her game is in the thick lane pick up tips while you cause some pain hundred dollar bills pot bellies on the prowl pick up your shirt to work is fly but foul a nympho i dont know but she can dance though start the show her system says go naked on the stage but lovin the pay peek a boo is the game the pure never play peek a boo the peep show peek a boo peek a boo peek a boo shes seventeen but claims to be eighteen boss on the tip in the back they do the wild thing sayin please wont get this sleaze to skease goes this skease only gs for fees only works late downtown 1st and pike yours for the night if the moneys right shes a stripper an avenol sipper down with the zipper cause nobody wants to kiss her shes the peek a boo pro yeah you know sportin high heels and swimsuits dancin at the strip show used to have a real name now they call her cocoa cocoa went loco so they paid to see her solo dancin on the stage crowds a rage they fill up the garter belt to keep the girl paid its a trip cause the girls clockin dollars with her hips like a ape doin flips for gratuity tips such a shame shes lookin up the deep throat fame a porno queen with a plastic name,peek boo true story young lady peek boo walkin zombie product system peek boo shes play game her own rules peek boo peak boo game deceptive her game thick lane pick tips while cause pain hundred dollar bills pot bellies prowl pick shirt work fly foul nympho she dance though start show her system says naked stage lovin pay peek boo game pure never play peek boo peep show peek boo peek boo peek boo shes seventeen claims eighteen boss tip wild thing sayin please wont sleaze skease goes skease gs fees works late downtown 1st pike yours night moneys right shes stripper avenol sipper down zipper cause nobody wants kiss her shes peek boo pro sportin high heels swimsuits dancin strip show used real name call her cocoa cocoa went loco paid her solo dancin stage crowds rage fill garter belt keep girl paid trip cause girls clockin dollars her hips ape doin flips gratuity tips such shame shes lookin deep throat fame porno queen plastic name
72600397,The 7A3,Hit 'Em Again,1980s,police maybe punks never our rhymes are slammin and we wont ever become intimidated by the gossip stated instead well strive and let it motivate us cause we are brothers dont try to diss the 3 will get evil and then commit assault with deadly lyrics and make you admit 7a3 we aint havin it when you recover youll try to contend but the 3 will be waitin and well hit you again intellectual seekers seekin intellect so if youre stalkin you better come correct and guaranteed that when i give you a taste its like i buck you in your head and your grill out your face so when they come to your funeral the caskets closed the secrets that you keep are never exposed,police maybe punks never rhymes are slammin wont ever become intimidated gossip stated instead strive motivate cause are brothers try diss 3 evil commit assault deadly lyrics admit 7a3 aint havin recover try contend 3 waitin hit again intellectual seekers seekin intellect youre stalkin better correct guaranteed taste buck head grill face funeral caskets closed secrets keep are never exposed
5603812,C.I.A.,Ill-Legal,1980s,the names have been changed to protect the innocent ah yeah right about now cia is in effect my name is dr dre their producer and we gon cold get retarted a little somethin like this all the guys act eerie why i dont know cause i am darryl but im not joe posse 1 to the mic ice cube thats you kid dee thats me im posse 2 sir jinx is without a doubt posse 3 3rd to the cut boy evidently funky fresh freshly funky kid dee is coldly coolin and my boys we bust out on the west cause i am rulin it schoolin it boy and you dont want none much like a 808 because my bass hums i am ill gettin iller ice cube is illustratin it a brand new cut keep the b boys hatin it dont get paid but thats alright i got the riches of a king when i hold the mic ill legal gettin busy a strong black villain ice cube sir jinx kid dee what chillin yeah west coast style the names have been changed to protect the innocent word now ice cubes gettin busy my girls are dizzy always on the scene with the schoolyard skizzy posse 2 playin def rhyme sayin and at the snooty fox is where im stayin,the names been changed protect innocent ah right cia effect name dr dre producer gon cold retarted little somethin guys act eerie cause am darryl joe posse 1 mic ice cube kid dee me posse 2 sir jinx without doubt posse 3 3rd cut boy evidently funky fresh freshly funky kid dee coldly coolin boys bust west cause am rulin schoolin boy none much 808 bass hums am ill gettin iller ice cube illustratin brand cut keep boys hatin paid alright got riches king hold mic ill legal gettin busy strong black villain ice cube sir jinx kid dee chillin west coast style names been changed protect innocent word ice cubes gettin busy girls are dizzy always scene schoolyard skizzy posse 2 playin def rhyme sayin snooty fox where stayin
7873325,Stetsasonic,Paul's Groove,1980s,[chorus mc delite] on fire on fire on fire on fire on fire on fire on fire on fire on fire [daddy o] we were born to be on got strong and life long our element of song could never steer you wrong we attack like a fleet and burn like the heat we win like a champ and the victory is sweet,[chorus mc delite] fire fire fire fire fire fire fire fire fire [daddy o] were born got strong life long element song never steer wrong attack fleet burn heat win champ victory sweet
52158339,Grandmaster Flash & The Furious Five,The Message (Re-Recorded / Remastered Version),1980s,its like a jungle sometimes it makes me wonder how i keep from going under its like a jungle sometimes it makes me wonder how i keep from going under broken glass everywhere people pissing on the stairs you know they just dont care i cant take the smell cant take the noise got no money to move out i guess i got no choice rats in the front room roaches in the back junkies in the alley with a baseball bat i tried to get away but i couldnt get far cause the man with the tow truck repossessed my car dont push me cause im close to the edge im trying not to lose my head its like a jungle sometimes it makes me wonder how i keep from going under standing on the front stoop hangin out the window watching all the cars go by roaring as the breezes blow a crazy lady livin in a bag eating out of garbage piles used to be a fag hag said she danced the tango skipped the light fandango was circon princess seemed to lost her senses down at the peepshow watching all the creeps so she can tell the stories to the girls back home she went to the city and got so so so ditty she had to get a pimp she couldnt make it on her own dont push me cause im close to the edge im trying not to lose my head its like a jungle sometimes it makes me wonder how i keep from going under its like a jungle sometimes it makes me wonder how i keep from going under my brothers doin bad stole my mothers tv says she watches to much is just not healthy,its jungle sometimes makes me wonder keep going under jungle sometimes makes me wonder keep going under broken glass everywhere people pissing stairs care cant smell cant noise got money move guess got choice rats front room roaches junkies alley baseball bat tried away couldnt far cause man tow truck repossessed car push me cause close edge trying lose head jungle sometimes makes me wonder keep going under standing front stoop hangin window watching cars roaring breezes blow crazy lady livin bag eating garbage piles used fag hag said she danced tango skipped light fandango was circon princess seemed lost her senses down peepshow watching creeps she tell stories girls home she went city got so ditty she had pimp she couldnt her own push me cause close edge trying lose head jungle sometimes makes me wonder keep going under jungle sometimes makes me wonder keep going under brothers doin bad stole mothers tv says she watches much healthy
1608863,Esham,Dream Girl,1980s,well i met this girl i was dazey crazy for the ho the bitch took my feelins and phazed me i know i shoulda watch my back but i didnt so my hate for the ho begins to grow i met her a month ago it wasnt bout money though as far as i could see her personality was cool so i talked and talked my intentions was to bone her but i found myself likeing her and bein all up on her she teased with the pussy had my mind in the twilight zone it was like dial a porn whenever we talked on the phone im asking her wassup when you gone let me hit it she said right now im hot and horny hurry come and get it,well met girl was dazey crazy ho bitch took feelins phazed me shoulda watch didnt hate ho begins grow met her month ago wasnt bout money though far her personality was cool talked talked intentions was bone her found myself likeing her bein her she teased pussy had mind twilight zone was dial porn whenever talked phone asking her wassup gone me hit she said right hot horny hurry it
2308079,Schoolly D,Am I Black Enough for You?,1980s,[cut and scratched x13 you are a negro] [cut and scratched now say it negro] [cut and scratched x3 say it negro] negro good learn to listen well youll get an education [schoolly d] am i black enough for ya america i dont need no { ice until this hair is cut} all i need is my blackness some others seem to lack this black joy and my black vibe gonna be a black man til the day i die im just rough and tough and takin no stuff all i really wanna know yall am i black enough [sung sample x2 am i black enough for ya] am i black enough [sung sample x2 am i black enough for ya] [sung sample,[cut scratched x13 are negro] [cut scratched negro] [cut scratched x3 negro] negro learn listen education [schoolly d] am black enough ya america need { ice hair cut} need blackness others seem lack black joy black vibe gonna black man til day die rough tough takin stuff really wanna yall am black enough [sung sample x2 am black enough ya] am black enough [sung sample x2 am black enough ya] [sung sample
18106307,Jungle Brothers,Acknowledge Your Own History,1980s,you dont know who you are look back into your past brother look back into your past sister you dont know who you are look back into your past sister look back into your past brother my forefather was a king he wore fat gold chains and fat ruby rings nobody believes this to be true maybe its because my eyes aint blue you aint gonna find it in your history book come here young blood and take a look you dig down deep inside this hard cover dont you know you was bought brother all you read about is slavery never about the black mans bravery you look at the pictures and all they show is african people with bones in their noses that aint true thats a lie you didnt get that from my lemon pie yeah i cut class i got a d cause history meant nothing to me,you are past brother past sister are past sister past brother forefather was king he wore fat gold chains fat ruby rings nobody believes true maybe eyes aint blue aint gonna find history book young blood dig down deep inside hard cover was bought brother read slavery never black mans bravery pictures show african people bones noses aint true lie didnt lemon pie cut class got d cause history meant nothing me
17862390,DJ Jazzy Jeff & The Fresh Prince,You Got It (Donut),1980s,[ jazzy jeff on the phone ] hello yeah i talked to him whoa whoa nah you aint got to explain nothin to me see you tried to play my man and end up playin yourself later for you nah matter of fact later for you and your golddiggin girlfriend you put me down with thought i was a donut3x tried to glaze me thought i was a donut3x thought i was a donut you tried to glaze me > rakim [ verse 1 the fresh prince ] this story that im about to tell ya is all about this girl named daliah 57 a gucci queen with gold all over that flowed like a stream i met her in a club on a saturday night the girls jeans were tight and i got hype i thought about talkin to this little miss but i kept seen guy after guy gettin dissed every guy that cracked got flagged but somethin kept sayin you you you bad i walked up and asked her to take a ride i whispered in her ear said my cars outside at first she laughed and said nah not yet then i told her its a vette and she said bet under one condition you gotta let me drive it she kissed me on the lips and i said you got it you got it,[ jazzy jeff phone ] hello talked him whoa whoa nah aint got explain nothin me tried play man end playin yourself later nah matter fact later golddiggin girlfriend me down thought was donut3x tried glaze me thought was donut3x thought was donut tried glaze me > rakim [ verse 1 fresh prince ] story tell ya girl named daliah 57 gucci queen gold flowed stream met her club saturday night girls jeans were tight got hype thought talkin little miss kept seen guy guy gettin dissed every guy cracked got flagged somethin kept sayin you bad walked asked her ride whispered her ear said cars outside she laughed said nah yet told her vette she said bet under condition gotta me drive she kissed me lips said got got it
38143955,Beastie Boys,Ask for Janice,1980s,the best in mens clothing call pauls boutique ask for janice,the best mens clothing call pauls boutique ask janice
1281484,Special Ed,Fly M.C.,1980s,i hold the fly microphone in the fly right hand im a real fly guy better yet fly man the title that i hold is the fly emcee why cause im fly yeah thats me you see im flier than a flyer to a hip hop jam i can even fly higher than a plane from panam flew took a flight yes to france in the fall they be cryin when im flyin cause im flier than them all went to france because i was bored so i took a flight over on the fly concorde on arrival i was greeted by the king of france the queen a band playin for the circumstance up came the royal crier he unrolled his scroll and said,i hold fly microphone fly right hand real fly guy better yet fly man title hold fly emcee cause fly me flier flyer hip hop jam fly higher plane panam flew took flight yes france fall cryin flyin cause flier went france was bored took flight fly concorde arrival was greeted king france queen band playin circumstance came royal crier he unrolled his scroll said
15710617,Kool Moe Dee,Knowledge Is King,1980s,i aint goin im gone up up up and away and im on a higher plane with a brain with a flame feel the fire desire the same knowledge and wisdom and understanding possessed by gods transferred to man in a script of a book a scripture that looks like a biblical writing inviting a hook of a song sing along with a strong subliminal message divesting all men from criminal acts of the devil revealed and reveled designed to recline the mind to lower level with no spiritual level read the holy koran or the bible because its liable to be a revival for the weak who seek power itll bring infallible power knowledge is king knowledge who wants some come get it a battle is a test of wits and im witted hard beats a torch and i lit it stop the music alright hit it now that it feels good im heating up i feed off knowledge and cant get enough knowledge is infinite suckers aint into it ignorance is bliss and theyre kin to it party and dance,i aint goin gone up away higher plane brain flame feel fire desire same knowledge wisdom understanding possessed gods transferred man script book scripture looks biblical writing inviting hook song sing along strong subliminal message divesting men criminal acts devil revealed reveled designed recline mind lower level spiritual level read holy koran bible liable revival weak seek power itll bring infallible power knowledge king knowledge wants battle test wits witted hard beats torch lit stop music alright hit feels heating feed off knowledge cant enough knowledge infinite suckers aint ignorance bliss kin party dance
99632701,MC 900 Ft. Jesus feat. DJ Zero,Talking to the Spirits,1980s,bed stay in bed the feeling of your skin locked in my head smoke smoke me broke i dont care im down for what you want day drunk into the night wanna keep you here cause you dry my tears yeah summer loving and fights how it is for us and its all because now if were talking body youve got a perfect one so put it on me swear it wont take you long if you love me right we fuck for life on and on and on now if were talking body youve got a perfect one so put it on me swear it wont take you long if you love me right we fuck for life on and on and on love can be love anything you want ill give it up,bed stay bed feeling skin locked head smoke smoke me broke care down day drunk night wanna keep cause dry tears summer loving fights were talking body youve got perfect me swear wont long love me right fuck life on were talking body youve got perfect me swear wont long love me right fuck life on love love anything ill up
19102181,Beastie Boys,Shadrach (Peanut Butter Wolf remix),1980s,riddle me this my brother can you handle it your style to my style you cant hold a candle to it equinox symmetry and the balance is right smokin and drinkin on a tuesday night its not how you play the game its how you win it i cheat and steal and sin and im a cynic for those about to rock we salute you the dirty thoughts for dirty minds we contribute to i once was lost but now im found the music washes over and youre one with the sound well who shall inherit the earth the meek shall and yo i think im starting to peak now al and then the man upstairs well i hope that he cares if i had a penny for my thoughts id be a millionaire were just three mcs and were on the go shadrach mesach abednago shadrach mesach abednago shadrach mesach abednago shadrach mesach abednago shadrach mesach abednago only twenty four hours in a day only twelve notes well a man can play music for all and not just one people and now were gonna bust with the putney swope sequel,riddle me brother handle style style cant hold candle equinox symmetry balance right smokin drinkin tuesday night play game win cheat steal sin cynic those rock salute dirty thoughts dirty minds contribute once was lost found music washes youre sound shall inherit earth meek shall yo starting peak al man upstairs hope he cares had penny thoughts id millionaire were three mcs were shadrach mesach abednago shadrach mesach abednago shadrach mesach abednago shadrach mesach abednago shadrach mesach abednago twenty four hours day twelve notes man play music people were gonna bust putney swope sequel
1461799,Biz Markie,This Is Something for the Radio,1980s,verse one this is another hit from biz markie dedicated to the radio not he or she be cause its time for them to get recognized this is my version of the nobel peace prize thats why im comin out my face like this far as negativity you never get dissed if it wasnt for you nobody would know thats why this is something for the radiohhhh verse two this rhyme is dedicated to the radio djs that play all the hits on seven days and even on the weekends the djs will be freakin without a doubt because everyone is unique and the way they cut the records and be talkin it sound doo doo extra crazy def on the walkman to all the disc jockeys thats on the go this is something for the radiohhhh biz ad libbing a harmony of for the radio randomly,verse another hit biz markie dedicated radio he she cause recognized version nobel peace prize comin face far negativity never dissed wasnt nobody something radiohhhh verse rhyme dedicated radio djs play hits seven days weekends djs freakin without doubt everyone unique cut records talkin sound doo doo extra crazy def walkman disc jockeys something radiohhhh biz ad libbing harmony radio randomly
9065790,Gucci Crew II,Sally "That Girl" (radio mix),1980s,one two three and i woke up early this morning and i went to the five dime i saw this pretty young lady that was real real fine i tapped her on the shoulder and said ehem excuse me maam she pulled down her pants and said smack these hams woooooo oh sally that girl woooooo oh sally phew that girl so we walked her to her house and she opened up the door it was a heart shaped bed in the middle of the floor she pushed me on the bed and this you can bet in between her legs was real real wet so i grabbed her by her thighs and i moved up truly she jumped off the bed and said dont touch my booty dont touch my booty cause i wont touch you dont touch my booty cause its not the thing to do woooooo oh sally phew that girl woooooo oh sally phew that girl so we bailed out her house just to get something to eat,one three woke early morning went five dime saw pretty young lady was real real fine tapped her shoulder said ehem excuse me maam she pulled down her pants said smack hams woooooo sally girl woooooo sally phew girl walked her her house she opened door was heart shaped bed middle floor she pushed me bed bet between her legs was real real wet grabbed her her thighs moved truly she jumped off bed said touch booty touch booty cause wont touch touch booty cause thing woooooo sally phew girl woooooo sally phew girl bailed her house something eat
2308080,Schoolly D,Don’t Call Me Nigger,1980s,as we all know you just cant believe everything you see and hear can you now if youll excuse me i must be on my way dont call me nigger whitey 2x dont call me nigger nigger whitey 2x the whitey my man you say youre my fan i look into your face and i gots to say damn i feel a lot of pain the money you gain because im black you think its come out of caine ill put you on a level same as the devil,as cant believe everything hear excuse me must call me nigger whitey 2x call me nigger nigger whitey 2x whitey man youre fan face gots damn feel lot pain money gain black caine ill level same devil
1236319,The 2 Live Crew,Cut It Up,1980s,fresh kid ice hey everybody you got to see how a dj should really be; cause when youre at a party and youre ready to jam; all other djs need a helping hand; i know how you feel; its like you wanna die; get with it; give ours a try; hes always on a pedestal above the rest; no shame to his game cause he gives his best; so when hes at a party the music never stops; cause mr mixx is here to cut it up [mixx scratches] brother marquis i must give credit where credit is due; and at the same time make known to you; because when you see is when you will believe; that there is not another dj with cuts like these;,fresh kid ice hey everybody got dj should really be; cause youre party youre ready jam; djs need helping hand; feel; wanna die; it; ours try; hes always pedestal above rest; shame his game cause he gives his best; hes party music never stops; cause mr mixx cut [mixx scratches] brother marquis must credit where credit due; same known you; believe; another dj cuts these;
1228410,The D.O.C.,Beautiful but Deadly,1980s,ayo stan dre layed the tracks im laying the vocals we need some guitar that rocks know what im saying so um lets do this shes a rich girl but not the ordinary extraordinary a little too much to carry possessed by a demon on a mission no man alive can refuse her proposition >from this fantasy but to me she was more than a bad dream she was a nightmare for man took her sex appeal and she taunted twisted the brother until he did just what she wanted direguard the laws of the other man sacrificing the plight of the brother man im not the type to let a woman make me weary but to resist hed have to be a fairy nothing that a brother wouldnt want to indulge in drives a porche and her purse is bulging,ayo stan dre layed tracks laying vocals need guitar rocks saying um lets shes rich girl ordinary extraordinary little too much carry possessed demon mission man alive refuse her proposition >from fantasy me she was more bad dream she was nightmare man took her sex appeal she taunted twisted brother he did she wanted direguard laws man sacrificing plight brother man type woman me weary resist hed fairy nothing brother wouldnt indulge drives porche her purse bulging
